Question,Answer,Context
"1.Question: According to the passage, who cursed Lakshmi to live in the ocean?",Answer: The sage Durvasa.,
2.Question: What is the significance of Lakshmi according to Vishnu?,Answer: Lakshmi helps Vishnu delude the universe with illusions (maya) and grants him powers.,"Context: ""But the demons defeated the gods and Indra. The sage Durvasa therefore cursed Lakshmi that she would have to live in the ocean."""
3.Question: Who did Indradyumna pray to in order to gain insight into true knowledge?,Answer: Indradyumna prayed to Vishnu.,"Context: ""It is with her help that I delude the universe and its inhabitants with my illusions (maya). It is Lakshmi who gives me all my powers, although she is no different from me in essence."""
"4.Question: What are the four classes (varnas) created by Brahma, according to Vishnu?","Answer: The four classes are brahmanas, kshatriyas, vaishyas, and shudras.","Context: ""When Lakshmi appeared, Indradyumna begged of her, 'Please tell me about yourself. Please give me insight into what constitutes true knowledge.' 'Even the gods and the sages are unable to comprehend my true nature,' replied Lakshmi. 'I am Vishnu's illusions and there is no difference between him and me. As for knowledge, it is beyond my powers to grant you that. You will have to pray to the great Vishnu himself.'"""
5.Question: Which stage of life involves retiring to the forest and living on fruits and roots?,Answer: The vanaprastha (forest dwelling) stage.,"Context: ""The brahmanas constitute the first of the four classes... The kshatriyas constitute the second of the four classes... The vaishyas constitute the third of the four classes... The shudras constitute the last of the four classes."""
"6.Question: Who emerged from Vishnu's anger, according to the passage?",Answer: Shiva.,"Context: ""The third stage of life is vanaprastha (forest dwelling stage). Such a person retires to the forest and lives on fruits and roots. He studies the Vedas, performs tapasya (meditation), and observes religious rites."""
"7.Question: What is the primary duty of the vaishyas, according to Vishnu's instructions?",Answer: Agriculture.,"Context: ""And Shiva emerged from Vishnu's anger."""
"8.Question: What are the six recommended actions for brahmanas, as mentioned in the passage?","Answer: Yajana (performing sacrifices), yajana (acting as priests at sacrifices), dana (donation of alms), pratigraha (receiving gifts), adhyapana (teaching), and adhyayana (studying).","Context: ""Like the kshatriyas, the vaishyas can also donate alms, study, and perform sacrifices. But their primary duty is agriculture."""
"9.Question: What is the first stage of life mentioned in the passage, and what are its primary duties?",Answer: The first stage is brahmacharya (celibate studenthood). Its primary duties are studying the Vedas and serving one's guru (teacher) well.,"Context: ""There are six types of action that are recommended for brahmanas. These are yajana (performing sacrifices), yajana (acting as priests at sacrifices), dana (donation of alms), pratigraha (receiving gifts), adhyapana (teaching), and adhyayana (studying)."""
"10.Question: According to the passage, what is the ultimate goal of a sannyasa (hermit)?",Answer: To attain supreme wisdom.,"Context: ""The first one is brahmacharya (celibate studenthood). The primary duties of a person who is in this stage of life are studying the Vedas and serving one's guru (teacher) well."""
11.Question: Who are the nine sons of Brahma mentioned in the passage?,"Answer: Marichi, Bhrigu, Angira, Pulastya, Pulaha, Kratu, Daksha, Atri, and Vashishtha.","Context: ""There are two types of hermits. The first type consists of those who are trying to realize the true nature of the atman (human soul). Such a person treats all other individuals as he would treat himself and is known as a yogi. But there are also hermits who go through intense meditation so as to attain the supreme wisdom. Such a person is known as a paramaeshthika."""
"12.Question: What are the primary duties of a kshatriya, according to Vishnu's instructions?","Answer: To take up arms, fight, punish evil, and protect the good.","Context: ""Brahma created nine sons from his mental powers. Their names were Marichi, Bhrigu, Angira, Pulastya, Pulaha, Kratu, Daksha, Atri, and Vashishtha."""
13.Question: What are the three stages of life mentioned in the passage?,"Answer: Brahmacharya (celibate studenthood), Grihastha (householder stage), and Vanaprastha (forest dwelling stage).","Context: ""The duties of kshatriyas include dana (donation of alms), adhyayana (studying), and performing yajnas (sacrifices). But their primary duties are to take up arms and fight. It is their job to punish the evil and protect the good."""
"14.Question: What are the traits demanded by the righteous way of life, as mentioned in the passage?","Answer: Forgiveness, pity, non-jealousy, sacrifice of selfish interests, truthfulness, practice of non-violence, sense control, and visiting tirthas (places of pilgrimage).","Context: ""The first stage of life is brahmacharya (celibate studenthood). The second stage of life is Grihastha (householder stage). The third stage of life is Vanaprastha (forest dwelling stage)."""
15.Question: What happens when an individual performs actions according to the concept mentioned in the passage?,Answer: The fruits of all actions vest with the Brahman (the divine essence).,"Context: ""There are various other traits that are demanded by the righteous way of life. One must forgive and display pity. One must not be jealous and must be ready to sacrifice one's own selfish interests. One must be truthful, practice non-violence, and learn to control the senses. One must also visit tirthas (places of pilgrimage)."""
"16.Question: According to the passage, what is the reason the householder stage is considered superior?",Answer: The alms provided by a householder are the means of sustenance for individuals in the other three stages of life.,"Context: ""The fruits of all actions vest with the Brahman (the divine essence). In fact, it is a gross misconception to think that the specific action is being performed by an individual. All actions are performed by the Brahman, the ordinary human being is merely an instrument."""
17.Question: What are the two types of forest-dwellers mentioned in the passage?,"Answer: Tapasya, who primarily devotes themselves to worshipping the gods and performing religious ceremonies, and Sannyasika, who devotes themselves entirely to meditation.","Context: ""The householder stage is superior to the other three stages of life. The reason is that the alms provided by a householder are the means of sustenance for individuals who are in the other three stages of life."""
"18.Question: What is the primary duty of a shudra, according to the passage?",Answer: To serve the other three classes and adopt artisanship as an occupation.,"Context: ""There are two types of forest-dwellers. The first type consists of individuals who primarily devote themselves to worshipping the gods and performing religious ceremonies. Such an individual is known as a tapasya because he does do some tapasya. But there are individuals who devote themselves entirely to meditation. Such a person is known as a sannyasika, since there is very little difference between him and a sannyasi (hermit)."""
19.Question: What must an individual realize in order to break free from the shackles of worldly bonds?,"Answer: An individual must realize that all actions are performed by the Brahman, and the ordinary human being is merely an instrument.","Context: ""The shudras constitute the last of the four classes. Their primary duty is to serve the other three classes. In addition, a shudra can adopt artisanship as an occupation."""
"20.Question: What is the ultimate goal of a sadhaka householder, according to the passage?",Answer: To be freed from the bonds of the world.,"Context: ""It is also important to realize that one does not perform actions for the sake of the fruits of the actions. The fruits of all actions vest with the Brahman (the divine essence). In fact, it is a gross misconception to think that the specific action is being performed by an individual. All actions are performed by the Brahman, the ordinary human being is merely an instrument."""
,"As an exam paper setter, I will create questions based on the document you provided, along with their respective answers and context from the passage:","Context: ""Alternatively, there may be a householder who is udasina. This means that he is not really interested in his wife, his sons, or in the acquisition of material wealth. His chief obsession is that of being freed from the bonds of the world."""
1.Question: What is the nature of the Brahman in the beginning of creation?,"Answer: The Brahman was everywhere, formless yet not without form, without beginning or end, impossible to describe, sense, or see.",
"2. Question: Explain the roles of Brahma, Vishnu, and Shiva in the process of creation.","Answer: Brahma performs the function of a creator, Vishnu that of a preserver, and Shiva that of a destroyer.","Context: ""In the beginning, the Brahman was everywhere. The Brahman had no form, but nor was it without form. It had no beginning and no end. It had no traits, but nor was it without traits. The Brahman is impossible to describe, sense or see."""
3. Question: Describe how Brahma created the universe at the beginning of creation.,"Answer:Brahma created water throughout the universe, and from that water, a golden egg (anda) appeared. Inside the egg, Brahma himself appeared.","Context: ""Brahma, Vishnu, and Shiva are derived from the Brahman. Brahma performs the function of a creator, Vishnu that of a preserver, and Shiva that of a destroyer."""
4. Question:Why is Brahma known as Hiranyagarbha?,Answer:Brahma is known as Hiranyagarbha because he originated from inside a golden (hiranya) egg (garbha).,"Context:""When it was time for creation to begin, the Brahman created water throughout the universe. Before that, there was nothing. In the water, there appeared a golden (hiranya) egg (anda). The egg grew in size, and Brahma, the creator, appeared inside the egg. Everything that there is in the universe was already there, in embryonic form, inside the egg."""
5. Question:Explain the significance of Vishnu's boar (Varaha) incarnation.,"Answer:During the end of the last kalpa, when the universe was submerged in water, Vishnu, in the form of a boar, raised the earth from under the water, allowing creation to start afresh. This event led to the present cycle being known as Varaha Kalpa.","Context:""Brahma was to be the lord (pati) of all the subjects who were going to be born (praja). Thus, Brahma acquired the name of Prajapati. To appreciate how creation took place, it is first necessary to have some conception about the nature of time. A Digression on Time."""
"6. Question:What is the significance of the Varaha Kalpa, and how did it get its name?","Answer:The Varaha Kalpa is the present cycle of creation. It is named after Vishnu's boar (Varaha) incarnation, during which he raised the earth from under the water at the beginning of the kalpa.","Context:""At the end of the last kalpa, there was water everywhere in the universe. The heaven, the earth, and the underworld were all flooded with water. There were no gods and no sages. Only the great Vishnu slept on the water. He had a thousand hoods, a thousand eyes, a thousand arms, and a thousand feet. This was his form of Ananta, the snake (naga). While Vishnu thus slept on the water, a wonderful lotus sprouted from his navel. The lotus was gigantic and shone like the sun. Its fragrance spread in all directions. Brahma appeared inside the lotus. Since padma means lotus and yoni means place of birth, Brahma is also known as Padmayoni."""
7. Question:Explain the concept of time in the Hindu cosmology and how it is structured.,"Answer:Time is divided into various units, starting from the smallest unit called nimesha. Fifteen nimeshas make one kashtha, and thirty kashthas are one kala. Thirty kalas constitute one muhurta, and there are thirty muhurtas in a day and night. Six months make up an ayana, and two ayanas constitute one year. There are twelve months in a year. One thousand mahayugas make up one kalpa, and at the end of a kalpa, there is a minor destruction known as pratisarga.","Context:""The present kalpa is known as Varaha kalpa. The one that preceded it was known as padma kalpa. 'Why is the present kalpa called Varaha kalpa?' the gods and the sages asked Vishnu. Vishnu told them the story of his boar incarnation."""
"8. Question:What are the names of Brahma's first five sons, and what role did they play in the creation process?","Answer:Brahma's first five sons were Sanaka, Sanatana, Sanandana, Kratu, and Sanatakumara. They became sages and did not have any offspring.","Context:""A Digression on Time: The smallest unit of time is a nimesha. Fifteen nimeshas make one kashtha, thirty kashthas are one kala, and thirty kalas constitute one muhurta. There are thirty muhurtas in a day and night (ahoratra). Twelve thousand years of the gods make up one mahayuga. There are a little over seventy-one manvantaras (eras) in each mahayuga. Three hundred and sixty kalpas constitute one of Brahma's years."""
9. Question:How did the creation of different beings take place according to the Kurma Purana?,"Answer:Brahma first created four classes of beings - gods, demons, ancestors (pitris), and humans. Other beings such as snakes, yakshas, ghosts, Gandharvas, cows, horses, elephants, and more were also created from different parts of Brahma's body.","Context:""Brahma first created five sons through his mental powers. Their names were Sanaka, Sanatana, Sanandana, Kratu, and Sanatakumara. These five sons became sages and did not have any offspring."""
"10. Question:Describe the significance of Brahma, Vishnu, and Shiva's roles in the creation process and their relationship.","Answer:Brahma is the creator, Vishnu is the preserver, and Shiva is the destroyer. They are derived from the Brahman and together form the Trimurti, representing the cycle of creation, preservation, and destruction in the universe.","Context:""Thereafter, Brahma created four classes of beings. These were gods, demons, ancestors (pitris), and humans. The demons were born from Brahma's thighs, the gods from his mouth. The snakes (sarpa), the yakshas (demi-gods), the ghosts (bhuta), and the Gandharvas were born next. Cows were born from Brahma's stomach, and horses, elephants, donkeys, deer, camels, and mules from his feet. Herbs and trees emerged from Brahma's body-hair."""
11. Question:How did Brahma and Vishnu have a unique interaction to understand each other's significance?,"Answer:Brahma and Vishnu engaged in a conversation where they decided to playfully test each other's powers. Vishnu allowed Brahma to enter his body, and upon doing so, Brahma discovered countless worlds inside Vishnu. However, when Brahma tried to confine Vishnu inside his body, he could not find an end to Vishnu's stomach, realizing the vastness of Vishnu's existence.","Context:""Brahma, Vishnu, and Shiva are derived from the Brahman. Brahma performs the function of a creator, Vishnu that of a preserver, and Shiva that of a destroyer. When it was time for creation to begin, the Brahman created water throughout the universe."""
"12. Question:What was the outcome of Shiva's interaction with Brahma and Vishnu, and how did they address their respective roles?","Answer:After Shiva's intervention, Brahma and Vishnu reconciled and recognized their limitations. Vishnu referred to Brahma as his son since Brahma emerged from a lotus that grew out of Vishnu's navel. They acknowledged their interconnectedness as the lords of everything and as parts of the Brahman.","Context:""Vishnu calmed Brahma down. He also gave Brahma divine eyes so that Brahma could comprehend the true nature of Shiva. Brahma then started to pray to Shiva. Pleased with Brahma's prayers, Shiva agreed to grant Brahma a boon. 'Please grant me the boon that you will be born as my son,' said Brahma. Shiva agreed to do so and went away."""
"13. Question:How did the earth come into existence, and which divine incarnation played a significant role in this creation process?","Answer:The earth came into existence when Vishnu, in his Varaha (boar) incarnation, raised it from under the water. The boar carefully lifted the earth and placed it on top of the water, allowing it to float like a gigantic boat.","Context:""'How dare you try to confine me inside your body?' demanded Brahma, as soon as he managed to get out. 'Please do not forget Shiva,' responded Vishnu. 'Your words will anger him and bring about your undoing.' While the two were thus conversing, Shiva appeared on the scene. He had a third eye in the middle of his forehead and his hair was matted. A trident could be seen in his hand. Vishnu calmed Brahma down. He also gave Brahma divine eyes so that Brahma could comprehend the true nature of Shiva."""
14. Question:What was the role of Brahma's sons and daughters in the process of creation?,"Answer:Brahma's sons became sages and played a significant role in the creation process. His daughters were married to various deities and sages, leading to the further propagation of beings in the universe.","Context:""Brahma decided to start creation afresh, but discovered that the earth was submerged in water. He, therefore, requested Vishnu to bring the earth up from under the water. Vishnu adopted the form of a boar and went to the underworld. He discovered the earth there and raised her up on the tusks of the boar. The boar carefully raised the earth and laid her to rest on top of the water. The earth began to float like a gigantic boat."""
"15. Question:Describe the nature of the Brahman and how it led to the creation of Brahma, Vishnu, and Shiva.","Answer:The Brahman is an all-pervading, formless entity with no beginning or end. It is both with and without form, impossible to describe, sense, or see. Brahma, Vishnu, and Shiva are derived from the Brahman, each having their respective roles. Brahma serves as the creator, Vishnu as the preserver, and Shiva as the destroyer.","Context:""Brahma first created five sons through his mental powers. Their names were Sanaka, Sanatana, Sanandana, Kratu, and Sanatakumara. These five sons became sages and did not have any offspring. Brahma next created eleven sons from his mental powers. Their names were Marichi, Bhrigu, Angira, Pulastya, Pulaha, Kratu, Daksha, Atri, Vashishtha, Dharma, and Sankalpa."""
16. Question:What was the significance of the golden egg (anda) that emerged in the water during creation?,"Answer:Before creation began, the Brahman created water throughout the universe. In the water, a golden (hiranya) egg (anda) appeared. This egg contained the entire universe in embryonic form, including gods, demons, humans, celestial bodies, and elements. Brahma, the creator, emerged inside this golden egg.","Context:""In the beginning, the Brahman was everywhere. The Brahman had no form, but nor was it without form. It had no beginning and no end. It had no traits, but nor was it without traits. The Brahman is impossible to describe, sense, or see. Brahma, Vishnu, and Shiva are derived from the Brahman, Brahma performs the function of a creator, Vishnu that of a preserver, and Shiva that of the destroyer."""
"17. Question:What is the significance of the names Hiranyagarbha, Svayambhu, and Prajapati in relation to Brahma?",Answer:Brahma is known as Hiranyagarbha because he originated from inside a golden (hiranya) egg (garbha). He is referred to as Svayambhu because he created himself. The name Prajapati was acquired by Brahma as he was to be the lord of all subjects to be born (praja).,"Context:""When it was time for creation to begin, the Brahman created water throughout the universe. Before that, there was nothing. In the water, there appeared a golden (hiranya) egg (anda). The egg grew in size, and Brahma, the creator, appeared inside the egg. Everything that there is in the universe was already there, in embryonic form, inside the egg. There were gods, the demons, humans, the sun, the moon, the stars, the planets, and the wind."""
"18. Question:What are the different units of time in Hindu cosmology, and how are they organized?","Answer:The smallest unit of time is a nimesha. Fifteen nimeshas make one kashtha, thirty kashthas make one kala, and thirty kalas constitute one muhurta. There are thirty muhurtas in a day and night (ahoratra). Thirty such ahoratras make up a month, and two pakshas (fortnights) make up a month. Six months constitute an ayana, and two ayanas make up a year. There are twelve months in every year. The kalpa is a larger unit, consisting of twelve thousand years of the gods.","Context:""Brahma was the first being to be created. He had four faces. He had no birth (janana) in the real sense of the term. He is, therefore, also referred to as Aja (without birth). It is also true that he created (bhuva) himself (svayam). It is because of this that Brahma is known as Svayambhu. Brahma was to be the lord (pati) of all the subjects who were going to be born (praja). Thus, Brahma acquired the name of Prajapati."""
