Question,Answer,Context
1. What is the significance of Kshatriya caste according to Linga Purana?,"Answer: According to Linga Purana, Lord Brahma created the Kshatriya caste for the protection of virtuosity during Treta Yuga.",
2. What is Vajreshwari Vidya and what is its significance?,Answer: Vajreshwari Vidya is a secret knowledge that Lord Brahma had taught to Indra with the help of which he had killed the ferocious demon Vritrasur. A person can acquire all types of supernatural powers with the help of this Vidya.,
3. How can a devotee become free from the fear of death according to Linga Purana?,"Answer: A person who chants Mrityunjay mantra with appropriate rituals becomes free from the fear of death. A devotee is required to make offerings of ghee in the sacrificial fire for one lakh times. Instead of ghee, he can also make offerings of ghee and sesame seeds or dhoob grass, ghee, milk, and honey.",
4. What are the natural qualities that the three deities represent according to Linga Purana?,"Answer: According to Linga Purana, Lord Brahma represents the quality of creation, Lord Vishnu represents the quality of preservation, and Lord Shiva represents the quality of destruction.",
5. What are the seven natural elements that Lord Brahma manifests himself in according to Linga Purana?,"Answer: According to Linga Purana, Lord Brahma manifests himself in seven natural elements - earth, water, fire, air, sky, mind, and intellect.",
6. What is the significance of Shivalinga and its worship according to Linga Purana?,Answer: Linga Purana elaborates upon the greatness of Shivalinga and its worship. It is believed that worshipping Shivalinga with devotion and appropriate rituals can help a person attain salvation.,
7. What is the story of Lord Shiva testing the patience of sages according to Linga Purana?,"Answer: According to Linga Purana, once upon a time, the sages were busy doing their penance to please Lord Mahadeva. Lord Shiva appeared before them in the form of a naked mendicant and tested their patience. The sages were initially angry but later realized that it was Lord Shiva's way of testing their devotion.",
8. What are the subjects covered in Linga Purana?,"Answer: Linga Purana covers a wide range of subjects like the beginning of creation, the origin of the universe, description of time, tales of different Kalpas, the greatness of Linga and its worship, tales related to Lord Shiva, characteristics of Shiva temple, etc.",
9. What is the identity of Mahesh according to Linga Purana?,"Answer: According to Linga Purana, Mahesh is the formless (Nirguna) identity of the almighty Brahma.",
10. What is the tale of Kshoopa accepting defeat according to Linga Purana?,"Answer: According to Linga Purana, when Lord Vishnu appeared before Kshoopa, he sought his help in defeating Dadhichi. However, Kshoopa was defeated by Dadhichi and he accepted his defeat gracefully.",
11. What is the story of the origin of Shivalinga according to Linga Purana?,"Answer: According to Linga Purana, Lord Brahma and Lord Vishnu once developed serious differences on the matter of superiority. A tremendous duel broke out between them. As they were fighting, a mammoth Linga appeared on the scene, the effulgence of which made both of them amazed. Both of them decided to find out the origin of that divine Linga. Lord Brahma transformed his appearance into that of a swan and flew up in the sky to determine the height of that Linga. Lord Vishnu transformed himself into a boar and entered the depth of earth to find the source of that Shivalinga. But both of them failed in their objectives and returned to the same place exhausted.",
12. What is the significance of the Mrityunjay mantra according to Linga Purana?,"Answer: According to Linga Purana, chanting the Mrityunjay mantra with appropriate rituals can help a person become free from the fear of death. A devotee is required to make offerings of ghee in the sacrificial fire for one lakh times. Instead of ghee, he can also make offerings of ghee and sesame seeds or dhoob grass, ghee, milk, and honey.",
13. What is the story of the creation of the universe according to Linga Purana?,"Answer: According to Linga Purana, the universe was created by Lord Brahma. He created the four Vedas, the four Yugas, and the four castes. He also created the ten Prajapatis and the seven great sages.",
14. What is the significance of Vajra and its use in the battle according to Linga Purana?,"Answer: According to Linga Purana, Vajra is a weapon that was created by Lord Indra with the help of Lord Brahma. It is made of the bones of sage Dadhichi and is believed to be indestructible. It was used by Lord Indra in the battle against the demons.",
15. What is the significance of the Kshatriya caste according to Linga Purana?,"Answer: According to Linga Purana, Lord Brahma created the Kshatriya caste for the protection of virtuosity during Treta Yuga. The Kshatriyas were responsible for protecting the people and maintaining law and order. [",
16. What is the significance of the Dwadakshar mantra according to Linga Purana?,"Answer: According to Linga Purana, the Dwadakshar mantra is a sacred mantra consisting of twelve letters 'OM NAMO BHAGAVATE VASUDE VAY'. This powerful mantra helps a person to achieve proximity with Lord Vishnu.",
17. What are the three prominent deities according to Linga Purana?,"Answer: According to Linga Purana, the three prominent deities are Brahma, Vishnu, and Mahesh. They are the manifestations of Lord Shiva. Lord Brahma is the creator, Lord Vishnu is the nurturer, and Lord Shiva is the annihilator.",
18. What is the significance of the three basic colors according to Linga Purana?,"Answer: According to Linga Purana, the three basic colors - red, white, and black are the symbolic expressions of the three qualities Raja, Sat, and Tamo respectively. Majority of people fall prey to the delusions of this world and get entangled in its illusionary appearances, but there are few that understand the futility of this illusionary world.",
19. What is the significance of the Mahattatva according to Linga Purana?,"Answer: According to Linga Purana, the Mahattatva is the five basic elements that were created by the supreme Almighty with the desire of beginning creation. The five basic elements are earth, water, fire, air, and sky.",
20. What is the significance of the Alinga Shiva according to Linga Purana?,"Answer: According to Linga Purana, the whole world along with the gross and subtle has originated from Alinga Shiva. The whole world comes into being with the help of eleven components - 10 sense organs and mind. It is pervaded by the delusions of 'Alinga Shiva'. Nature is pervaded by the delusion of Shiva, which is also known as Aja (unborn).",
21. What is the significance of the three qualities according to Linga Purana?,"Answer: According to Linga Purana, the three qualities - Raja, Sat, and Tamo are the symbolic expressions of the three basic colors - red, white, and black respectively. These qualities are present in all living beings and objects. The balance of these qualities determines the nature and behavior of a person or object.",
22. What is the significance of the delusions of this world according to Linga Purana?,"Answer: According to Linga Purana, the delusions of this world are the illusionary appearances that trap people and prevent them from realizing the true nature of reality. Majority of people fall prey to these delusions and get entangled in them. However, there are few who understand the futility of this illusionary world and strive to attain salvation.",
"23. What is the significance of the Aja according21. What is the role of Lord Shiva in the creation, sustenance, and destruction of the universe according to Linga Purana?","Answer: According to Linga Purana, Lord Shiva plays a significant role in the creation, sustenance, and destruction of the universe. He is the creator in the form of Brahma, the nurturer in the form of Vishnu, and the annihilator in his own form. Lord Shiva is the ultimate source from which the whole world originates and to which it eventually returns.",
22. What is the significance of Shiva temples according to Linga Purana?,"Answer: According to Linga Purana, Shiva temples hold great significance as they are considered sacred abodes of Lord Shiva. Worshipping in these temples with devotion and performing rituals can help devotees attain spiritual growth, blessings, and liberation. The Linga within the temple represents the divine presence of Lord Shiva.",
23. What are the natural qualities associated with Shiva according to Linga Purana?,"Answer: According to Linga Purana, the natural qualities associated with Shiva are taste, smell, touch, and sound. These qualities become apparent in the world because of Shiva, who is imperishable and pervades everything.",
24. What is the concept of salvation or liberation in Linga Purana?,"Answer: According to Linga Purana, salvation or liberation is the ultimate goal of human life. It is the state of being free from the cycle of birth and death, and attaining union with the divine. The Purana emphasizes that devotion, righteous actions, and spiritual practices can lead to liberation and eternal bliss.",
25. What are the different forms or manifestations of Lord Shiva mentioned in Linga Purana?,"Answer: According to Linga Purana, Lord Shiva has various forms or manifestations. The three prominent ones are Brahma, Vishnu, and Mahesh, representing the roles of creator, nurturer, and annihilator respectively. Lord Shiva also has other forms and avatars mentioned in different Puranas and scriptures.",
26. What is the significance of the story of Lord Shiva testing the patience of sages according to Linga Purana?,"Answer: According to Linga Purana, the story of Lord Shiva testing the patience of sages highlights the importance of patience and devotion in the path of spiritual growth. The sages were performing penance to please Lord Shiva, but he tested their patience by appearing before them in various forms and causing disturbances. However, the sages remained steadfast in their devotion and patience, and Lord Shiva eventually appeared before them in his true form and blessed them. This story emphasizes the importance of perseverance and faith in the face of obstacles.",
27. What is the significance of the story of Kshoopa accepting defeat according to Linga Purana?,"Answer: According to Linga Purana, the story of Kshoopa accepting defeat highlights the power of devotion and the importance of seeking help from the divine. Kshoopa was a demon who sought the help of Lord Vishnu in defeating Dadhichi, a sage who possessed an indestructible weapon. Lord Vishnu advised Kshoopa to seek the help of Lord Shiva, who eventually blessed Kshoopa with the power to defeat Dadhichi. This story emphasizes the importance of seeking divine help and the power of devotion in overcoming obstacles.",
28. What is the significance of the story of Lord Brahma and Lord Vishnu failing to find the origin of the Shivalinga according to Linga Purana?,"Answer: According to Linga Purana, the story of Lord Brahma and Lord Vishnu failing to find the origin of the Shivalinga highlights the incomprehensible nature of the divine. Lord Brahma and Lord Vishnu were engaged in a fierce argument about their superiority, and a Shivalinga appeared before them. They decided to find the origin of the Shivalinga, but both of them failed in their attempts. This story emphasizes the incomprehensible nature of the divine and the futility of trying to understand it through human intellect alone.",
29. What is the significance of the Mrityunjay mantra according to Linga Purana?,"Answer: According to Linga Purana, the Mrityunjay mantra is a powerful mantra that can help a person overcome the fear of death and attain spiritual growth. The Purana prescribes specific rituals and offerings to be made while chanting the mantra, and emphasizes the importance of devotion and faith",
30. Who compiled the divine tales of Linga Purana?,"Answer: The Linga Purana is believed to have been compiled by the sage Romaharshana, also known as Lomaharshana.",
31. What are the three natural qualities that the three deities represent?,"Answer: According to Linga Purana, the three deities - Brahma, Vishnu, and Mahesh represent the three natural qualities - Satva, Rajas, and Tamas respectively. Satva represents purity and goodness, Rajas represents passion and activity, and Tamas represents darkness and ignorance.",
32. What are the seven natural elements that the almighty Brahma manifests himself in?,"Answer: According to Linga Purana, the almighty Brahma manifests himself in seven natural elements - mind, intellect, ego, space, air, fire, and water. These elements are the building blocks of the universe and are essential for creation and sustenance.",
33. What is the significance of the story of Lord Shiva and Parvati's marriage according to Linga Purana?,Answer:,
34. What is the significance of the story of the demon Jalandhara according to Linga Purana?,Answer:,
35. What is the significance of the story of the churning of the ocean according to Linga Purana?,Answer:,
